{
  "format_version": 1,
  "plan_id": "5",
  "target": {
    "target_id": "poseidon-ckks-cpu",
    "capability_version": 1,
    "operator_spec": {
      "id": "poseidon-ckks-cpu-v1",
      "version": 1,
      "fingerprint": "sha256:3df4bd521e4c6bdbbdf9a6f923d301c02cc73760673b6e4e24ec2d1c3b31a8cf"
    },
    "rescale_mode": "eager",
    "boot_mode": "native",
    "world_size": 1,
    "device_counts": [
      1
    ],
    "required_capabilities": [
      "transfer"
    ]
  },
  "values": [
    {
      "id": "1",
      "kind": "plaintext",
      "place": {
        "kind": "host",
        "rank": 0
      },
      "context": "ctx-main",
      "level": 5,
      "scale_log2": 40,
      "ntt": true,
      "components": 1
    },
    {
      "id": "2",
      "kind": "ciphertext",
      "place": {
        "kind": "host",
        "rank": 0
      },
      "context": "ctx-main",
      "level": 5,
      "scale_log2": 40,
      "ntt": true,
      "components": 2
    },
    {
      "id": "3",
      "kind": "plaintext",
      "place": {
        "kind": "device",
        "rank": 0,
        "index": 0
      },
      "context": "ctx-main",
      "level": 5,
      "scale_log2": 40,
      "ntt": true,
      "components": 1
    },
    {
      "id": "4",
      "kind": "ciphertext",
      "place": {
        "kind": "device",
        "rank": 0,
        "index": 0
      },
      "context": "ctx-main",
      "level": 5,
      "scale_log2": 40,
      "ntt": true,
      "components": 2
    },
    {
      "id": "5",
      "kind": "ciphertext",
      "place": {
        "kind": "device",
        "rank": 0,
        "index": 0
      },
      "context": "ctx-main",
      "level": 5,
      "scale_log2": 80,
      "ntt": true,
      "components": 2
    }
  ],
  "external_inputs": [
    "1",
    "2"
  ],
  "required_keys": [],
  "initialization": [
    {
      "ordinal": 0,
      "kind": "transfer",
      "transfer_id": "1",
      "hint": "auto",
      "inputs": [
        "1"
      ],
      "outputs": [
        "3"
      ],
      "sources": [
        {
          "kind": "host",
          "rank": 0
        }
      ],
      "destinations": [
        {
          "kind": "device",
          "rank": 0,
          "index": 0
        }
      ],
      "output_kinds": [
        "plaintext"
      ]
    },
    {
      "ordinal": 1,
      "kind": "transfer",
      "transfer_id": "2",
      "hint": "auto",
      "inputs": [
        "2"
      ],
      "outputs": [
        "4"
      ],
      "sources": [
        {
          "kind": "host",
          "rank": 0
        }
      ],
      "destinations": [
        {
          "kind": "device",
          "rank": 0,
          "index": 0
        }
      ],
      "output_kinds": [
        "ciphertext"
      ]
    }
  ],
  "execution": [
    {
      "ordinal": 2,
      "kind": "compute",
      "op": "mul_cp",
      "place": {
        "kind": "device",
        "rank": 0,
        "index": 0
      },
      "inputs": [
        "4",
        "3"
      ],
      "output": "5"
    }
  ],
  "finalization": [],
  "final_outputs": [
    "5"
  ],
  "plaintext_bundle": {
    "id": "v005-demo-weights",
    "version": 1,
    "fingerprint": "sha256:881ece04a4184592d106493a781bc6b5afe3b647f39de9befceb13a6a26e4245"
  },
  "fingerprint": "sha256:5dfb4336d408dcca15a9265c0e0be577129f3b8f0ef6c72b7e196a0a24632b24"
}
