{
  "format_version": 1,
  "plan_id": "4",
  "target": {
    "target_id": "poseidon-ckks-gpu",
    "capability_version": 1,
    "operator_spec": {
      "id": "poseidon-ckks-gpu-v1",
      "version": 1,
      "fingerprint": "sha256:6d78861376555678db29a3ac21ce5275a7118c98addf298e9ad8b1f4579da71c"
    },
    "rescale_mode": "lazy",
    "boot_mode": "decrypt_reencrypt",
    "world_size": 1,
    "device_counts": [
      1
    ],
    "required_capabilities": [
      "transfer",
      "host_compute",
      "boot_decrypt_reencrypt"
    ]
  },
  "values": [
    {
      "id": "1",
      "kind": "ciphertext",
      "place": {
        "kind": "host",
        "rank": 0
      },
      "context": "ctx-main",
      "level": 2,
      "scale_log2": 40,
      "ntt": true,
      "components": 2
    },
    {
      "id": "2",
      "kind": "ciphertext",
      "place": {
        "kind": "device",
        "rank": 0,
        "index": 0
      },
      "context": "ctx-main",
      "level": 2,
      "scale_log2": 40,
      "ntt": true,
      "components": 2
    },
    {
      "id": "3",
      "kind": "ciphertext",
      "place": {
        "kind": "host",
        "rank": 0
      },
      "context": "ctx-main",
      "level": 2,
      "scale_log2": 40,
      "ntt": true,
      "components": 2
    },
    {
      "id": "4",
      "kind": "ciphertext",
      "place": {
        "kind": "host",
        "rank": 0
      },
      "context": "ctx-main",
      "level": 12,
      "scale_log2": 40,
      "ntt": true,
      "components": 2
    },
    {
      "id": "5",
      "kind": "ciphertext",
      "place": {
        "kind": "device",
        "rank": 0,
        "index": 0
      },
      "context": "ctx-main",
      "level": 12,
      "scale_log2": 40,
      "ntt": true,
      "components": 2
    }
  ],
  "external_inputs": [
    "1"
  ],
  "required_keys": [
    {
      "kind": "secret",
      "place": {
        "kind": "host",
        "rank": 0
      }
    }
  ],
  "initialization": [
    {
      "ordinal": 0,
      "kind": "transfer",
      "transfer_id": "1",
      "hint": "auto",
      "inputs": [
        "1"
      ],
      "outputs": [
        "2"
      ],
      "sources": [
        {
          "kind": "host",
          "rank": 0
        }
      ],
      "destinations": [
        {
          "kind": "device",
          "rank": 0,
          "index": 0
        }
      ],
      "output_kinds": [
        "ciphertext"
      ]
    }
  ],
  "execution": [
    {
      "ordinal": 1,
      "kind": "transfer",
      "transfer_id": "2",
      "hint": "auto",
      "inputs": [
        "2"
      ],
      "outputs": [
        "3"
      ],
      "sources": [
        {
          "kind": "device",
          "rank": 0,
          "index": 0
        }
      ],
      "destinations": [
        {
          "kind": "host",
          "rank": 0
        }
      ],
      "output_kinds": [
        "ciphertext"
      ]
    },
    {
      "ordinal": 2,
      "kind": "compute",
      "op": "boot",
      "place": {
        "kind": "host",
        "rank": 0
      },
      "inputs": [
        "3"
      ],
      "output": "4",
      "attrs": {
        "target_level": 12,
        "target_scale_log2": 40,
        "target_components": 2,
        "operator_profile": "poseidon-cpu-boot-emulation-v1",
        "implementation": "decrypt_reencrypt"
      }
    },
    {
      "ordinal": 3,
      "kind": "transfer",
      "transfer_id": "3",
      "hint": "auto",
      "inputs": [
        "4"
      ],
      "outputs": [
        "5"
      ],
      "sources": [
        {
          "kind": "host",
          "rank": 0
        }
      ],
      "destinations": [
        {
          "kind": "device",
          "rank": 0,
          "index": 0
        }
      ],
      "output_kinds": [
        "ciphertext"
      ]
    }
  ],
  "finalization": [],
  "final_outputs": [
    "5"
  ],
  "fingerprint": "sha256:40aaa60fafe4adff88cbc80e555af1a3705e60df7414d4fe1ed8e0fdbbe4f81b"
}
